{
  "context_version": 1,
  "role": "hub_receiver",
  "channel": "poll",
  "now": "2030-01-01T00:00:00.000Z",
  "clock_skew_s": 300,
  "accepted_protocol_versions": [
    "2.0.0-draft"
  ],
  "accepted_message_kinds": [
    "transcode.unclaimed"
  ],
  "expected_audience": "hub:cell-test-a",
  "known_key_ids": [
    "test-wk2hub-k1",
    "test-wk2hub-k2"
  ],
  "expect": {
    "org_uuid": "11111111-1111-7111-8111-111111111111",
    "video_uuid": "22222222-2222-7222-8222-222222222222",
    "owning_cell_id": "cell-test-a",
    "placement_epoch": 7,
    "lifecycle_revision": 3,
    "attempt_id": "33333333-3333-7333-8333-333333333333",
    "dispatch_id": "44444444-4444-7444-8444-444444444444"
  }
}
