{
  "context_version": 1,
  "role": "hub_receiver",
  "channel": "storage",
  "accepted_manifest_versions": [
    "1.0.0-draft"
  ],
  "accepted_message_kinds": [
    "generation.manifest"
  ],
  "expect": {
    "org_uuid": "11111111-1111-7111-8111-111111111111",
    "video_uuid": "22222222-2222-7222-8222-222222222222",
    "attempt_id": "33333333-3333-7333-8333-333333333333",
    "dispatch_id": "44444444-4444-7444-8444-444444444444",
    "execution_id": "55555555-5555-7555-8555-555555555555",
    "source_id": "66666666-6666-7666-8666-666666666666",
    "profile": {
      "id": "test-h264-sdr",
      "version": 1,
      "sha256": "abababababababababababababababababababababababababababababababab"
    },
    "encryption": {
      "mode": "aes-128",
      "media_key_id": "77777777-7777-7777-8777-777777777777"
    },
    "renditions": [
      "720p",
      "480p",
      "360p"
    ],
    "max_artifact_count": 10
  }
}
