{
  "context_version": 1,
  "role": "hub_sender",
  "channel": "dispatch",
  "now": "2030-01-01T00:00:00.000Z",
  "clock_skew_s": 300,
  "accepted_protocol_versions": [
    "2.0.0-draft"
  ],
  "accepted_message_kinds": [
    "transcode.request"
  ],
  "expected_audience": "worker:runpod-test",
  "known_key_ids": [
    "test-hub2wk-k1"
  ],
  "expect": {
    "org_uuid": "11111111-1111-7111-8111-111111111111",
    "video_uuid": "22222222-2222-7222-8222-222222222222",
    "owning_cell_id": "cell-test-a",
    "placement_epoch": 7,
    "lifecycle_revision": 3,
    "attempt_id": "33333333-3333-7333-8333-333333333333",
    "dispatch_id": "44444444-4444-7444-8444-444444444444",
    "source_id": "66666666-6666-7666-8666-666666666666",
    "source_location_id": "aaaaaaaa-aaaa-7aaa-8aaa-aaaaaaaaaaaa",
    "output_location_id": "bbbbbbbb-bbbb-7bbb-8bbb-bbbbbbbbbbbb",
    "profile": {
      "id": "test-h264-sdr",
      "version": 1,
      "sha256": "abababababababababababababababababababababababababababababababab"
    },
    "encryption": {
      "mode": "aes-128",
      "media_key_id": "77777777-7777-7777-8777-777777777777"
    },
    "renditions": [
      "720p",
      "480p",
      "360p"
    ],
    "max_artifact_count": 25209
  }
}
