{
  "context_version": 1,
  "role": "worker_receiver",
  "channel": "push",
  "now": "2030-01-01T00:00:00.000Z",
  "clock_skew_s": 300,
  "accepted_protocol_versions": [
    "2.0.0-draft"
  ],
  "accepted_message_kinds": [
    "transcode.claim.granted"
  ],
  "expected_audience": "worker:runpod-test",
  "known_key_ids": [
    "test-hub2wk-k1"
  ],
  "expect": {
    "org_uuid": "11111111-1111-7111-8111-111111111111",
    "video_uuid": "22222222-2222-7222-8222-222222222222",
    "owning_cell_id": "cell-test-a",
    "placement_epoch": 7,
    "lifecycle_revision": 3,
    "attempt_id": "33333333-3333-7333-8333-333333333333",
    "dispatch_id": "44444444-4444-7444-8444-444444444444",
    "output_location_id": "bbbbbbbb-bbbb-7bbb-8bbb-bbbbbbbbbbbb",
    "encryption": {
      "mode": "aes-128",
      "media_key_id": "77777777-7777-7777-8777-777777777777"
    },
    "runtime_id": "88888888-8888-7888-8888-888888888888"
  }
}
